event_time,invoice_id,event,amount_rub,actor,comment
2026-04-30 17:10,contract_addendum,Подписано допсоглашение,0,менеджер клиента,Расширенные отчёты включены в пакет на первые три месяца
2026-05-07 18:30,tariff_catalog,Обновлён справочник тарифов,0,продуктовая команда,Расширенные отчёты стали отдельной строкой по умолчанию
2026-05-12 19:10,INV-7841,Создан исходный счёт,1380000,система,Включена отдельная строка за Расширенные отчёты
2026-05-14 12:10,contract_exception,Создано исключение по договору,0,выставление счетов,"Исключение действует для мая, июня, июля"
2026-05-14 12:35,INV-7841-CORR,Создан исправленный счёт,1200000,выставление счетов,Строка за Расширенные отчёты удалена
2026-05-14 13:20,INV-7841-CORR,Исправленный счёт передан менеджеру,1200000,выставление счетов,Перед отправкой клиенту
